,x,y,z,cluster,last name,given name,citation
462,0.32786768674850464,0.12991157174110413,0.41844862699508667,9,Pearl,Judea,For contributions to artificial intelligence through the development of a calculus for probabilistic and causal reasoning.
463,0.36111730337142944,0.34944480657577515,0.752729594707489,4,Hirschberg,Julia,For contributions to spoken language processing.
464,0.46112534403800964,0.8225178122520447,0.5504570603370667,0,Fall,Kevin,For contributions to delay-tolerant networking.
465,0.6876361966133118,0.5570566058158875,0.8348300457000732,6,Skadron,Kevin,"For contributions in power- and thermal-aware modeling, design and benchmarking of microprocessors, including GPUs."
466,0.671791672706604,0.1234041154384613,0.3280244469642639,1,Franz,Michael,For contributions to just-in-time compilation and optimization and to compiler techniques for computer security.
467,0.5047690868377686,0.7657817602157593,0.18448024988174438,5,Luby,Michael George,"For contributions to coding theory, cryptography, parallel algorithms and derandomization."
468,0.9999998807907104,0.2580457329750061,0.5404787659645081,3,Rung-Tsong Lyu,Michael,For contributions to the theory and practice of software reliability engineering.
469,0.3458658456802368,0.6138148903846741,0.028302371501922607,8,Wooldridge,Michael,For contributions to multi-agent systems and the formalization of rational action in multi-agent environments.
470,0.21437793970108032,0.7155391573905945,0.1188364028930664,8,Amato,Nancy M,For contributions to robotics and leadership in broadening participation in computing.
471,0.8296208381652832,0.6506651043891907,0.5675031542778015,3,Grumberg,Orna,For contributions to research in automated formal verification of hardware and software systems.
472,0.40922433137893677,0.6967378258705139,0.7130671143531799,4,McDaniel,Patrick,For contributions to computer and mobile systems security.
473,0.26049724221229553,0.6331958770751953,0.8407676815986633,4,Dourish,Paul,For contributions in social computing and human-computer interaction.
474,0.03915730118751526,0.5736494660377502,0.26587027311325073,2,Schroeder,Peter,For contributions to computer graphics and geometry processing.
475,0.47791561484336853,0.046424299478530884,0.7646684646606445,7,Guha,Ramanathan,For contributions to structured data representation and specification and their impact on the Web.
476,0.44769471883773804,0.3277834951877594,0.1678963005542755,9,Vempala,Santosh,For contributions to algorithms for convex sets and probability distributions.
477,0.8171762824058533,0.6517107486724854,0.5769294500350952,3,Sagiv,Shmuel,For contributions to the theory and practice of automated analysis and verification of software.
478,0.9599055051803589,0.38746362924575806,0.5258011221885681,3,Rajamani,Sriram,For contributions to software analysis and defect detection.
479,0.5854713916778564,0.059317052364349365,0.36989688873291016,1,Warnow,Tandy,"For contributions to mathematical theory, algorithms, and software for large-scale molecular phylogenetics and historical linguistics."
480,0.7626299858093262,0.8768887519836426,0.6978747248649597,6,Kuo,Tei-Wei,For contributions to performance and reliability enhancement of flash-memory storage systems.
481,0.4661984443664551,0.7698876857757568,0.3731234669685364,0,Maurer,Ueli M,For contributions to cryptography and information security.
482,0.48348164558410645,0.7029455900192261,0.3529273271560669,0,Miller,Victor,For contributions to cryptography and software research.
483,0.4304209351539612,0.07676929235458374,0.6202793717384338,7,Tan,Wang-Chiew,For contributions to data provenance and to the foundations of information integration.
484,0.8776077032089233,0.4252987504005432,0.5466252565383911,3,Leroy,Xavier,"For contributions to safe, high-performance functional programming languages and compilers, and to compiler verification."
485,0.4909379184246063,0.6254860162734985,0.6678397059440613,0,Liu,Yunhao,For contributions to sensor networks.
486,0.10530972480773926,0.5940110087394714,0.49777162075042725,2,Finkelstein,Adam,"For contributions to non-photorealistic rendering, multi-resolution representations, and computer graphics."
487,0.5844641923904419,0.5920184254646301,0.15143579244613647,5,Borodin,Allan,"For contributions to theoretical computer science in complexity, on-line algorithms, resource tradeoffs, and models of algorithmic paradigms."
488,0.4628174901008606,0.378181129693985,0.24264496564865112,9,Srinivasan,Aravind,"For contributions to algorithms, probabilistic methods, and networks."
489,0.5029718279838562,0.024736016988754272,0.6767094135284424,7,Bachman,Charles W,"For contributions to database technology, notably the integrated data store"
490,0.21968725323677063,0.7485523223876953,0.08386576175689697,8,Rus,Daniela,For contributions to robotics and sensor networks.
491,0.6174315214157104,0.22059020400047302,0.5885273218154907,1,Ellen,Faith,"For contributions to data structures, and the theory of distributed and parallel computing."
492,0.346902996301651,0.14867937564849854,0.43773341178894043,9,Horvitz,Eric,"For contributions to artificial intelligence, and human-computer interaction."
493,0.7023177146911621,0.42972058057785034,0.38562291860580444,1,Guzdial,Mark,"For contributions to computing education, and broadening participation."
494,0.6593933701515198,0.5453014969825745,0.6822834014892578,6,Ranganathan,Parthasarathy,"For contributions to the areas of energy efficiency and server architectures.
"
495,0.13589799404144287,0.576669454574585,0.3619512915611267,2,Grimson,Eric,"For contributions to computer vision, and medical image computing."
496,0.5135972499847412,0.12815558910369873,0.6507278084754944,7,Afrati,Foto,For contributions to the theory of database systems.
497,0.782965898513794,0.7112250328063965,0.6356536149978638,6,Heiser,Gernot,For contributions demonstrating that provably correct operating systems are feasible and suitable for real-world use.
498,0.23992674052715302,0.7488626837730408,0.5144945979118347,2,Schulzrinne,Henning,"For contributions to the design of protocols, applications, and algorithms for Internet multimedia."
499,0.5077659487724304,0.3165014386177063,0.27464133501052856,1,Dhillon,Inderjit,"For contributions to large-scale data analysis, machine learning and computational mathematics."
