,x,y,z,cluster,last name,given name,citation
308,0.2955971360206604,0.5983686447143555,0.8016877174377441,4,Gilbert,Juan E,For contributions to broadening participation in computing and to accessible voting technologies
309,0.46206575632095337,0.949642539024353,0.5508365631103516,0,Borner,Katy,For contributions to methods and tools that enable users to render data into actionable insights
310,0.7184521555900574,0.37045079469680786,0.7385193705558777,6,Asanovic,Krste,"For contributions to computer architecture, including the open RISC-V instruction set and Agile hardware development"
311,0.40944719314575195,0.543695330619812,0.7053056955337524,4,Qiu,Lili,For contributions to the design and analysis of wireless network protocols and mobile systems
312,0.31384027004241943,0.31461018323898315,0.7001005411148071,9,Lee,Lillian,"For contributions to natural language processing, sentiment analysis, and computational social science"
313,0.3671145439147949,0.5217025279998779,0.1407397985458374,8,Littman,Michael,For contributions to the design and analysis of sequential decision making algorithms in artificial intelligence
314,0.4975215494632721,0.6655452251434326,0.1622966229915619,5,Hajiaghayi,Mohammad T.,For contributions to the fields of algorithmic graph theory and algorithmic game theory
315,0.4126301407814026,0.6899162530899048,0.6850020289421082,4,Asokan,N,"For contributions to systems security and privacy, especially of mobile systems"
316,0.6091934442520142,0.768244743347168,0.5773959755897522,0,Barham,Paul,For contributions to the design of operating systems and scalable distributed information processing systems
317,0.49093616008758545,0.28412097692489624,0.24718204140663147,1,Bartlett,Peter L,For contributions to the theory of machine learning
318,0.8604251742362976,0.289203017950058,0.5576367974281311,3,Devanbu,Premkumar T,For contributions to using software data and meta-data to improve software tools and processes
319,0.4559304416179657,0.24646437168121338,0.24762499332427979,9,Isbell,Charles Lee,For contributions to interactive machine learning; and for contributions to increasing access and diversity in computing
320,0.7898114323616028,0.48364952206611633,0.24368581175804138,5,Hughes,John,For contributions to software testing and functional programming.
321,0.6039148569107056,0.8284386992454529,0.18535608053207397,5,Sahai,Amit,For contributions to cryptography and to the development of indistinguishability obfuscation
322,0.46805378794670105,0.7251101732254028,0.4615667164325714,0,Basin,David,For contributions to Information Security and Formal Methods
323,0.4975605905056,0.23838311433792114,0.5691254734992981,7,Garofalakis,Minos,"For contributions to data processing and analytics, particularly data streaming, approximation, and uncertainty."
324,0.33917972445487976,0.5845836400985718,0.7680825591087341,4,Heinzelman,Wendi Beth,For contributions to wireless communication systems and protocols and leadership in broadening participation in computing
325,0.32757964730262756,0.09034433960914612,0.46436768770217896,9,Darwiche,Adnan,For contributions to the foundations and technology of automated reasoning
326,0.8445818424224854,0.4266795814037323,0.584008514881134,3,Bodik,Rastislav,For contributions to program synthesis
327,0.582783579826355,0.807638943195343,0.18014881014823914,5,Vadhan,Salil,"For advancing computational complexity and cryptography, and for promoting public support for theoretical computer science"
328,0.3962920308113098,0.6383127570152283,0.44602352380752563,0,Dwarkadas,Sandhya,For contributions to shared memory and reconfigurability
329,0.5597521066665649,0.4423202872276306,0.15879783034324646,5,Khanna,Sanjeev,"For contributions to approximation algorithms, hardness of approximation, and sublinear algorithms"
330,0.216154545545578,0.7490191459655762,0.8104344606399536,4,Feiner,Steven,"For contributions to human-computer interaction, virtual and augmented reality, and 3D user interfaces"
331,0.03889358043670654,0.5017398595809937,0.06956544518470764,2,Dey,Tamal K,For contributions to computational geometry and computational topology
332,0.054665714502334595,0.4800141155719757,0.17288684844970703,2,Funkhouser,Thomas,For research contributions in computer graphics
333,0.5000662207603455,0.618729829788208,0.6882902979850769,0,He,Tian ,"For contributions to wireless networks, sensing systems, and Internet of things (IoT)"
334,0.3821636736392975,0.20116984844207764,0.5491187572479248,9,Finin,Tim,For contributions to theory and practice of knowledge sharing in distributed systems and the World-Wide Web
335,0.6440460681915283,0.6524226069450378,0.22837790846824646,5,Pitassi,Toniann,For contributions to research and education in the fields of computational and proof complexity
336,0.5470468997955322,0.9228757619857788,0.5724377632141113,0,Misra,Vishal,"For contributions to network traffic modeling, congestion control and Internet economics"
337,0.8404515981674194,0.399664968252182,0.4172487258911133,3,Gupta,Aarti,For contributions to system analysis and verification techniques and their transfer to industrial practice
338,0.48874539136886597,0.181167870759964,0.41700035333633423,1,Zhang,Aidong,For contributions to bioinformatics and data mining
339,0.6191713809967041,0.660820722579956,0.05751201510429382,5,Vardy,Alexander,For contributions to the theory and practice of error-correcting codes and their study in complexity theory
340,0.6573226451873779,0.5336505174636841,0.6729358434677124,6,Sivasubramaniam,Anand,For contributions to power management of datacenters and high-end computer systems
341,0.6504144072532654,0.3585939407348633,0.8543844223022461,6,Moshovos,Andreas,For contributions to high-performance architecture including memory dependence prediction and snooping coherence
342,0.6899646520614624,0.7254626750946045,0.36287063360214233,5,Prabhakar,Balaji,For developing algorithms and systems for large-scale data center networks and societal networks
343,0.09253782033920288,0.4779224395751953,0.506536066532135,2,Schoelkopf,Bernhard,For contributions to the theory and practice of machine learning
344,0.2572985291481018,0.7495481371879578,0.1325259804725647,8,Gomes,Carla,"For establishing the field of computational sustainability, and for foundational contributions to artificial intelligence"
345,0.37987589836120605,0.2966572344303131,0.4477497935295105,9,Zhai,Chengxiang,For contributions to information retrieval and text data mining
346,0.3376786410808563,0.49440625309944153,0.39597785472869873,9,Lynch,Clifford A,"For contributions to library automation, information retrieval, scholarly communication, and information policy"
347,0.37678104639053345,0.12472018599510193,0.5334773659706116,9,Knoblock,Craig,"For contributions to artificial intelligence, semantic web, and semantic data integration"
348,0.6469691395759583,0.5090934038162231,0.15566787123680115,5,Gusfield,Dan,For contributions to combinatorial optimization and to algorithmic computational biology
349,0.1544816493988037,0.6012454032897949,0.34843385219573975,2,Comaniciu,Dorin,"For contributions to machine intelligence, diagnostic imaging, image-guided interventions, and computer vision"
350,0.49202680587768555,0.8205212354660034,0.5582009553909302,0,Keromytis,Angelos Dennis,For contributions to the theory and practice of systems and network security
351,0.5618356466293335,0.15219789743423462,0.4734592139720917,1,Kesselman,Carl,"For contributions to high-performance computing, distributed systems, and scientific data management"
352,0.6486417055130005,0.8350518345832825,0.7903602123260498,6,Hand,Steven Michael,For contributions to virtual machines and cloud computing
353,0.17435291409492493,0.5626451969146729,0.5222220420837402,2,Rui,Yong,"For contributions to image, video and multimedia analysis, understanding, and retrieval"
354,0.5449481010437012,0.508762001991272,0.6220228672027588,6,Cohen,Edith,For contributions to the design of efficient algorithms for networking and big data
355,0.3954043388366699,0.45865198969841003,0.7580131888389587,4,Li,Li Erran,"For contributions to the design and analysis of wireless networks, improving architectures, throughput, and analytics"
356,0.6433084011077881,0.8478081822395325,0.7775468826293945,0,Bugnion,Edouard,For contributions to virtual machines
357,0.3504822254180908,0.4972704350948334,0.39177146553993225,9,Fox,Edward Alan,For contributions in information retrieval and digital libraries
358,0.42193275690078735,0.5928449034690857,0.7655608057975769,4,Knightly,Edward,"For contributions to multi-user wireless LANs, wireless networks for underserved regions, and cross-layer wireless networking"
359,0.6837356686592102,0.45394542813301086,0.805047869682312,6,Loh,Gabriel H,For contributions to die-stacking technologies in computer architecture
360,0.9101158380508423,0.3386049270629883,0.543064296245575,3,Murphy,Gail C,For contributions to recommenders for software engineering and to program comprehension
361,0.5963166952133179,0.8310187458992004,0.5812468528747559,0,Voelker,Geoffrey,"For contributions to empirical measurement and analysis in systems, networking and security"
362,0.16402798891067505,0.6156700849533081,0.3393551707267761,2,Hager,Gregory,For contributions to vision-based robotics and to computer-enhanced interventional medicine
363,0.7893105745315552,0.698474109172821,0.6253725290298462,6,Lee,Insup,For theoretical and practical contributions to compositional real-time scheduling and runtime verification
364,0.5568810701370239,0.9222525954246521,0.5649489760398865,0,Ramakrishnan,K. K.,"For contributions to congestion control, operating system support for networks and virtual private networks"
365,0.6505138278007507,0.22949615120887756,0.587363064289093,1,Kale,Laxmikant,For development of new parallel programming techniques and their deployment in high performance computing applications
366,0.5159651637077332,0.6208212375640869,0.7994728088378906,6,Srivastava,Mani B.,"For contributions to sensor networks, mobile personal sensing, and cyber-physical systems"
367,0.9523581266403198,0.3289828300476074,0.4469529092311859,3,Burnett,Margaret,"For contributions to end-user software engineering, understanding gender biases in software, and broadening participation in computing"
368,0.6729464530944824,0.669539213180542,0.2852686643600464,5,Grohe,Martin,"For contributions to logic in computer science, database theory, algorithms, and computational complexity"
369,0.8054112195968628,0.5581800937652588,0.8511004447937012,6,Wong,Martin,For contributions to the algorithmic aspects of electronic design automation (EDA)
370,0.10205256938934326,0.5196441411972046,0.3564099073410034,2,Kass,Michael,"For contributions to computer vision and computer graphics, particularly optimization and simulation"
371,0.6222163438796997,0.6163754463195801,0.19086545705795288,5,Sipser,Michael,"For contributions to computational complexity, particularly randomized computation and circuit complexity"
372,0.6690126061439514,0.9863975048065186,0.5556718707084656,0,Harchol-Balter,Mor,For contributions to performance modeling and analysis of distributed computing systems
373,0.21309715509414673,0.4625012278556824,0.8607568740844727,4,Oliver,Nuria,"For contributions in probabilistic multimodal models of human behavior and uses in intelligent, interactive systems"
374,0.5032013058662415,0.24349373579025269,0.2712130844593048,1,Mccallum,Andrew K.,"For contributions to machine learning with structured data, and innovations in scientific communication"
375,0.8697811961174011,0.5256490707397461,0.468502938747406,3,Birkedal,Lars,For contributions to the semantic and logical foundations of compilers and program verification systems
376,0.6394824385643005,0.3666937053203583,0.8246682286262512,6,Mutlu,Onur,"For contributions to computer architecture research, especially in memory systems"
377,0.4161022901535034,0.2950100600719452,0.48095622658729553,9,Yang,Qiang,For contributions to artificial intelligence and data mining
378,0.07949551939964294,0.5369572639465332,0.37589073181152344,2,Ramamoorthi,Ravi,For contributions to computer graphics rendering and physics-based computer vision
379,0.652511715888977,0.9864566922187805,0.5210573077201843,0,Fujimoto,Richard M,For contributions to parallel and distributed discrete event simulation
380,0.5987488031387329,0.8236222267150879,0.25084221363067627,5,Goldwasser,Shafi,For transformative work that laid the complexity-theoretic foundations for the science of cryptography
381,0.18810635805130005,0.5867348909378052,0.5241783857345581,2,Chang,Shih Fu,For contributions to large-scale multimedia content recognition and multimedia information retrieval
382,0.5987415313720703,0.8236271739006042,0.25082072615623474,5,Micali,Silvio,For transformative work that laid the complexity-theoretic foundations for the science of cryptography
383,0.08034801483154297,0.5746045112609863,0.3777708411216736,2,Seitz,Steve,For contributions to computer vision and computer graphics
384,0.12047228217124939,0.6131141185760498,0.8018681406974792,4,Dray,Susan,For co-founding ACM SIGCHI and disseminating exemplary user experience design and evaluation practices worldwide
385,0.5345997214317322,0.7581785321235657,0.260195255279541,5,Rabin,Tal,"For contributions to foundations of cryptography, including multi-party computations, signatures, and threshold and proactive protocol design"
386,0.2309669554233551,0.589685320854187,0.11020281910896301,8,Lozano-Perez,Tomas,"For contributions to robotics, and motion planning, geometric algorithms, and their applications"
387,0.6190439462661743,0.6599045395851135,0.05795440077781677,5,Guruswami,Venkatesan,"For contributions to algorithmic coding theory, pseudorandomness, and the complexity of approximate optimization"
388,0.5382028222084045,0.7143335342407227,0.4637157618999481,0,Lee,Wenke,"For contributions to systems and network security, intrusion and anomaly detection and malware analysis"
389,0.0924096405506134,0.3628165125846863,0.2641335725784302,2,Ma,Yi,For contributions to theory and application of low-dimensional models for computer vision and pattern recognition
390,0.1755029261112213,0.6907843351364136,0.8617638349533081,4,Rogers,Yvonne,For contributions to human-computer interaction and the design of human-centered technology
391,0.5026535391807556,0.7844069004058838,0.557563304901123,0,Perrig,Adrian,For contributions in protocols for network and system security.
392,0.19739949703216553,0.6454644799232483,0.8730552196502686,4,Druin,Allison,For contributions to creating information and computing technologies with and for children.
393,0.6556247472763062,0.39015570282936096,0.8377325534820557,6,Seznec,Andre,For contributions to branch prediction and cache memory design.
394,0.6216050386428833,0.8583403825759888,0.5250494480133057,0,Kermarrec,Anne-Marie,For contributions to large-scale distributed computing.
395,0.6569116711616516,0.42011693120002747,0.38764628767967224,1,Hey,Anthony,For leadership in high performance computing and eScience.
396,0.4921196699142456,0.22624874114990234,0.40587273240089417,1,Brodley,Carla,For applications of machine learning and for increasing participation of women in computer science.
397,0.08046048879623413,0.5913411974906921,0.38381853699684143,2,Tomasi,Carlo,For contributions in computer vision.
398,0.6106976270675659,0.4962582588195801,0.6235224008560181,6,Kozyrakis,Christos,For contributions to transactional memory and data center architecture.
399,0.5006802678108215,0.7328603267669678,0.38160428404808044,0,Boneh,Dan,For contributions to cryptography and computer security.
400,0.8327536582946777,0.3271107077598572,0.5317064523696899,3,Jackson,Daniel,For contributions to software modeling and the creation of the modeling language Alloy.
401,0.5884482860565186,0.5548032522201538,0.24404022097587585,5,Peleg,David,For contributions to distributed computing and graph algorithms.
402,0.439454585313797,0.02318522334098816,0.6719423532485962,7,Raschid,Louiqa,"For data management and integration in non-traditional domains including biomedicine, finance, and humanitarian applications."
403,0.16264650225639343,0.7127587795257568,0.8009899854660034,4,Jacob,Robert J.K.,"For contributions to human-computer interaction, particularly new interaction modes and novel user interface software formalisms."
404,0.43102285265922546,0.6541786193847656,0.9514970183372498,4,Patel,Shwetak N,"For contributions to sustainability sensing, low-power wireless sensing, and mobile health."
405,0.5980210304260254,0.5010477900505066,0.6200050115585327,6,Sengupta,Sudipta,"For contributions to cloud networking, storage, and data management."
406,0.6887345314025879,0.36347153782844543,0.6740738153457642,6,Mowry,Todd C,For contributions to software prefetching and thread-level speculation.
407,0.0,0.4941103458404541,0.06167179346084595,2,Demaine,Erik,"For contributions to geometric computing, data structures, and graph algorithms."
408,0.07979613542556763,0.5136067867279053,0.477258563041687,2,Durand,Fredo,For contributions to computational photography and computer graphics rendering.
409,0.8508678674697876,0.41176146268844604,0.6319607496261597,3,Ramalingam,Ganesan,For contributions to static program analysis.
410,0.3765450119972229,0.13296586275100708,0.5383898019790649,9,Hendler,James,For contributions to artificial intelligence and the development of the Semantic Web.
411,0.2840768098831177,0.6587786078453064,0.8766682147979736,4,Landay,James,"For contributions to human-computer interaction, with a focus on user interface design tools and ubiquitous computing."
412,0.37568730115890503,0.6102251410484314,0.7190084457397461,4,Flinn,Jason,For contributions to mobile computing and reliable distributed systems.
413,0.5188354849815369,0.9125049114227295,0.6069879531860352,0,Lyles,Joseph Bryan,"For contributions to local network technology, internet measurement, and research."
414,0.18852895498275757,0.40434396266937256,0.8632422089576721,4,Cassell,Justine,For contributions to human-computer interaction and advocacy for empowerment and voice through technology.
415,0.8901351690292358,0.37505990266799927,0.5831713676452637,3,Leino,K. Rustan M.,For contributions to making program verification accessible and practical.
416,0.7130546569824219,0.49704959988594055,0.954723596572876,6,Benini,Luca,For contributions to the design of low power multi-processor systems.
417,0.2693853974342346,0.6164824962615967,0.08072024583816528,8,Veloso,Manuela,"For contributions to the field of artificial intelligence, in particular in planning, learning, multi-agent systems, and robotics."
418,0.5398507118225098,0.10029289126396179,0.7307325005531311,7,Kersten,Martin,For the design and implementation of column-store and main-memory database systems.
419,0.5838310122489929,0.5636157393455505,0.1963055431842804,5,Saks,Michael E,"For contributions to computational complexity, theory of distributed computing, and design and analysis of algorithms."
420,0.6257059574127197,0.5297466516494751,0.13472458720207214,5,Henzinger,Monika,For contributions to computing theory and its practical application.
421,0.475735068321228,0.8534015417098999,0.6091035604476929,0,Feamster,Nick,For data-driven studies of Internet security and Internet censorship.
422,0.610599935054779,0.5021425485610962,0.109171062707901,5,Alon,Noga,"For contributions in the study of expander graphs, derandomization and streaming algorithms.
"
423,0.4975363612174988,0.8654941916465759,0.5831929445266724,0,Barford,Paul,For contributions to Internet measurement and analysis.
424,0.47842657566070557,0.740181565284729,0.43850961327552795,0,Van Oorschot,Paul,"For contributions to applied cryptography, authentication and computer security."
425,0.18214792013168335,0.6852126121520996,0.8517475724220276,4,Sellen,Abigail,For contributions to human-computer interaction and the design of human-centered technology.
426,0.02534586191177368,0.5455372333526611,0.4205048382282257,2,Rushmeier,Holly E,"For work on global illumination, material capture, and display of high-dynamic-range images."
427,0.7099398970603943,0.16451212763786316,0.30481821298599243,1,Kwiatkowska,Marta,For contributions to the theory and practice of probabilistic verification.
428,0.538451611995697,0.9364123344421387,0.6245414018630981,0,Perlman,Radia,For contributions to the theory and practice of Internet routing and bridging protocols.
429,0.634881854057312,0.5494401454925537,0.8098929524421692,6,Gupta,Rajesh,For contributions in design of embedded systems and hardware-software codesign.
430,0.6894511580467224,0.20030775666236877,0.5662584900856018,1,Kannan,Ravi,For contributions to the field of theoretical computer science.
431,0.6622806787490845,0.565261721611023,0.6978176832199097,6,Bianchini,Ricardo,"For contributions to power, energy, and thermal management of servers and datacenters."
432,0.5584591031074524,0.1618308424949646,0.4851178228855133,1,Grossman,Robert L.,"For contributions to data science, data intensive computing and data mining."
433,0.7542943954467773,0.42577046155929565,0.8206536769866943,6,Sapatnekar,Sachin S.,For contributions to the enhancement of performance and reliability in integrated circuits.
434,0.19972586631774902,0.43070948123931885,0.8618521690368652,4,Oviatt,Sharon,"For contributions to the empirical and theoretical foundations of multimodal systems, and to human-centered computer interfaces."
435,0.9739292860031128,0.4165477156639099,0.5323768854141235,3,Jha,Somesh,"For contributions to verification, programming languages, and software engineering."
436,0.9060494899749756,0.44983094930648804,0.6804260015487671,3,Blackburn,Stephen,For contributions to memory management in programming languages.
437,0.6632376909255981,0.4550308585166931,0.8350663185119629,6,Mudge,Trevor,For contributions to power aware computer architecture.
438,0.6391155123710632,0.41189175844192505,0.3913780450820923,1,Taylor,Valerie,For leadership in broadening participation in computing.
439,0.3528609871864319,0.5858583450317383,0.7523858547210693,4,Padmanabhan,Venkata,For research contributions and professional leadership in networked and mobile computing systems.
440,0.08469724655151367,0.5078034400939941,0.4817015826702118,2,Freeman,William,"For contributions to low-level computer vision, machine learning, and computer graphics."
441,0.3649747669696808,0.373279333114624,0.7598519921302795,4,Huang,Xuedong,For contributions to spoken language processing.
442,0.32044291496276855,0.10462746024131775,0.5045042037963867,9,Gil,Yolanda,For leadership in advancing the use of artificial intelligence in support of science and for service to the community.
443,0.4162605404853821,0.27931562066078186,0.47577959299087524,9,Zhou,Zhi-Hua,For contributions to machine learning and data mining.
444,0.5019433498382568,0.06475052237510681,0.6962589025497437,7,Ailamaki,Anastasia,"For contributions to the design, implementation, and evaluation of modern database systems."
445,0.5123451352119446,0.20199298858642578,0.5758938193321228,7,Schuster,Assaf,For contributions to cloud computing.
446,0.63373202085495,0.4853644073009491,0.6305797100067139,6,Falsafi,Babak,For contributions to multiprocessor and memory architecture design and evaluation.
447,0.3998008072376251,0.25820446014404297,0.48548421263694763,9,Liu,Bing,"For contributions to knowledge discovery and data mining, opinion mining, and sentiment analysis."
448,0.43656641244888306,0.28192979097366333,0.45807281136512756,9,Lin,Chih-Jen,For contributions to the theory and practice of machine learning and data mining.
449,0.5642544031143188,0.8434109091758728,0.1424887478351593,5,Dwork,Cynthia,"For contributions to the science of database privacy, cryptography, and distributed computing."
450,0.5390633344650269,0.26805514097213745,0.22313439846038818,1,Blei,David M.,For contributions to the theory and practice of probabilistic topic modeling and Bayesian machine learning.
451,0.5774129629135132,0.5999451875686646,0.8151819705963135,6,Chang,Naehyuck,For contributions to low-power computing systems.
452,0.6769328117370605,0.8151369690895081,0.4480710029602051,0,Rodriguez,Pablo,For contributions to content distribution architectures in peer-to-peer networks.
453,0.000991135835647583,0.4861796796321869,0.14686349034309387,2,Indyk,Piotr,"For contributions to high-dimensional geometric computing, streaming/sketching algorithms, and the Sparse Fourier Transform."
454,0.4922585189342499,0.24961936473846436,0.5490838289260864,9,Pei,Jian,"For contributions to the foundation, methodology and applications of data mining."
455,0.22113707661628723,0.641219437122345,0.7766176462173462,4,Czerwinski,Mary P.,For contributions to human-computer interaction and leadership in the CHI community.
456,0.3194201588630676,0.3243567943572998,0.7176272869110107,9,Radev,Dragomir R,For contributions to natural language processing and computational linguistics
457,0.30461275577545166,0.6441324949264526,0.9176416397094727,4,Mynatt,Elizabeth D.,For contributions to human-centered computing and to the development of health information technologies.
458,0.8676336407661438,0.5208908915519714,0.47329309582710266,3,Pfenning,Frank,For contributions to the logical foundations of automatic theorem proving and types for programming languages.
459,0.31986016035079956,0.014507114887237549,0.48319941759109497,9,De Giacomo,Giuseppe,"For contributions to description logics, data management, and verification of data-driven processes"
460,0.5027914047241211,0.1625552475452423,0.38962483406066895,1,Chen,Hsinchun,For contributions to the research and development of security informatics and health informatics systems.
461,0.48927122354507446,0.06917029619216919,0.6978646516799927,7,Haritsa,Jayant R,For contributions to the theory and practice of data management systems.
