,x,y,z,cluster,last name,given name,citation
157,0.29780274629592896,0.34200847148895264,0.44281572103500366,9,Allan,James,"For contributions to information retrieval, including topic detection and tracking"
158,0.18636584281921387,0.7196323871612549,0.8592487573623657,4,Forlizzi,Jodi,For contributions to design research in human-computer interaction
159,0.308178186416626,0.6411328911781311,0.9287304282188416,4,Canny,John,"For contributions in robotics, machine perception, human-computer interaction, and ubiquitous computing"
160,0.7311872839927673,0.1846725046634674,0.2936663031578064,1,Katoen,Joost-Pieter,For contributions to model checking of software and probabilistic systems
161,0.8434210419654846,0.5736888647079468,0.49248671531677246,3,Meseguer,Jose,For the development of logical methods for design and verification of computational systems
162,0.7616424560546875,0.7784476280212402,0.6620253920555115,6,Thompson,Kenneth Lane,For contributions to the development of operating systems theory and for the implementation of the UNIX operating system
163,0.415558397769928,0.6221701502799988,0.08379349112510681,8,Leyton-Brown,Kevin,"For contributions to artificial intelligence, including computational game theory, multi-agent systems, machine learning, and optimization"
164,0.4818049371242523,0.6639750003814697,0.6309326887130737,0,Ren,Kui,For contributions to wireless system security and cloud data security
165,0.03474283218383789,0.49975061416625977,0.3331295847892761,2,Zhou,Kun,For contributions to computer graphics
166,0.5194279551506042,0.512522280216217,0.637967586517334,6,Tassiulas,Leandros,For contributions to network control and optimization with applications in communication networks
167,0.9261951446533203,0.38616448640823364,0.4764879643917084,3,Briand,Lionel,For contributions to automated software testing
168,0.2357076108455658,0.5293377637863159,0.1513042449951172,8,Mataric,Maja,For contributions to socially assistive robotics and human-robot systems
169,0.6449317932128906,0.23206192255020142,0.577960729598999,1,Parashar,Manish,For contributions to high-performance parallel and distributed computing and computational science
170,0.6156994104385376,0.7412353754043579,0.2169550657272339,5,Blum,Manuel,For contributions to the foundations of computational complexity theory and its application to cryptography and program checking
171,0.46805936098098755,0.87403804063797,0.2839243412017822,0,Hellman,Martin,For the invention of asymmetric public-key cryptography and the promulgation of a practical cryptographic key-exchange method
172,0.15431258082389832,0.6836850047111511,0.8712252974510193,4,Rosson,Mary Beth,"For contributions to human-computer interaction, including scenario-based design"
173,0.029012709856033325,0.4232301115989685,0.2007395327091217,2,Desbrun,Mathieu,For contributions to geometry processing and discrete differential geometry
174,0.12506350874900818,0.5373826026916504,0.5920360684394836,2,Turk,Matthew A,"For contributions to face recognition, computer vision, and multimodal interaction"
175,0.5122506618499756,0.7410947680473328,0.19399619102478027,5,Rabin,Michael O.,"For fundamental, pioneering contributions to the theory of computation, probabilistic algorithms, and cryptography"
176,0.5669291019439697,0.8259234428405762,0.16090691089630127,5,Naor,Moni,For contributions to the foundations of cryptography and theoretical computer science
177,0.5478779673576355,0.4642011821269989,0.1944299042224884,5,Charikar,Moses,"For design of efficient algorithmic techniques for big data, hashing, approximation algorithms, and metric embeddings"
178,0.9949290752410889,0.273292601108551,0.5373296737670898,3,Nagappan,Nachiappan,For contributions to empirical software engineering and data-driven software development
179,0.739291787147522,0.5158247351646423,0.8584526777267456,6,Kim,Nam Sung,For contribution to design and modeling of power-efficient computer architectures
180,0.7656633853912354,0.5036603808403015,0.23199909925460815,5,Higham,Nicholas,"For contributions to numerical linear algebra, numerical stability analysis, and communication of mathematics"
181,0.052531272172927856,0.4368308186531067,0.19908010959625244,2,Sorkine-Hornung,Olga,"For contributions to digital geometry processing, computer animation, computer graphics and visual computing"
182,0.8893631100654602,0.5325778126716614,0.4354017376899719,3,Cousot,Patrick,For contributions to programming languages through the invention and development of abstract interpretation
183,0.3705936670303345,0.28641563653945923,0.5622594356536865,9,Resnick,Paul,"For contributions to recommender systems, economics and computation, and online communities"
184,0.26691901683807373,0.6322505474090576,0.08919748663902283,8,Stone,Peter,"For contributions to automated planning, learning, and multiagent systems with applications in robotics and ecommerce"
185,0.7698966860771179,0.5008688569068909,0.06361383199691772,5,Panangaden,Prakash,For making continuous state systems amenable to logical and computational treatment
186,0.4036099910736084,0.6164487600326538,0.5369365215301514,0,Cormode,Graham R.,For contributions to data summarization and privacy enabling data management and analysis
187,0.376140296459198,0.09948396682739258,0.5469107031822205,9,Sheth,Amit,For contributions to data semantics and knowledge-enhanced computing
188,0.7240194082260132,0.5054521560668945,0.979981541633606,6,Chandrakasan,Anantha,For energy-efficient design methodologies and circuits that enabled ultralow-power wireless sensors and computing devices
189,0.455443799495697,0.039239585399627686,0.6541473269462585,7,Ilyas,Ihab F.,For contributions to data cleaning and data integration
190,0.4210701584815979,0.5646300911903381,0.7480719089508057,4,Banerjee,Suman,"For contributions to design, implementation, and tools of wireless systems"
191,0.811465859413147,0.5646810531616211,0.8605831861495972,6,Chang,Yao-Wen,For contributions to algorithmic electronic design automation
192,0.5141384601593018,0.12988850474357605,0.6482225656509399,7,Abadi,Daniel J,"For contributions to distributed databases, column-store databases, deterministic databases, graph databases, and stream databases"
193,0.44108331203460693,0.6552556157112122,0.7031874656677246,4,Kotz,David,"For contributions to the security, privacy, and usability of mobile systems"
194,0.5621914267539978,0.08050504326820374,0.4530676007270813,1,Troyanskaya,Olga,"For contributions to computational biology, data integration and deep learning applications for genome interpretation"
195,0.22071188688278198,0.7630164623260498,0.1329437792301178,8,Nagpal,Radhika,"For contributions to collective intelligence,  including self-organizing systems and swarm robotics"
196,0.4910578429698944,0.7436679005622864,0.39242881536483765,0,Canetti,Ran,For  contributions to cryptography and computer security
197,0.5344072580337524,0.6622837781906128,0.42017513513565063,0,Kumar,Ravi,"For contributions to web science modeling, analytics, and algorithms"
198,0.7519854307174683,0.8150849938392639,0.6685335636138916,6,Arpaci-Dusseau,Remzi,For contributions to storage and computer systems
199,0.5979148149490356,0.16904503107070923,0.4867294430732727,1,Stevens,Rick,"For contributions in high-performance computing systems, collaborative environments, and tools for large-scale science initiatives"
200,0.7557664513587952,0.8450515866279602,0.6816567182540894,6,Noh,Sam H.,"For contributions to storage system software, including flash and byte-addressable non-volatile memory"
201,0.4615394175052643,0.12163904309272766,0.7105854749679565,7,Madden,Samuel,For contributions to data management and sensor computing systems
202,0.722295343875885,0.871874213218689,0.6434067487716675,0,Ghemawat,Sanjay,For contributions to distributed systems design
203,0.8466389179229736,0.6593814492225647,0.564731240272522,3,Seshia,Sanjit Arunkumar,"For contributions to formal verification, inductive synthesis, and cyber-physical systems"
204,0.7019734382629395,0.34949007630348206,0.7057172060012817,6,Mahlke,Scott,"For contributions in compiler code generation for instruction level parallelism, and customized microprocessor architectures"
205,0.21187016367912292,0.6744376420974731,0.510173499584198,2,Panchanathan,Sethuraman,"For contributions to multimedia technologies and leadership in the scientific community
"
206,0.14758411049842834,0.6013820767402649,0.5013882517814636,2,Yan,Shuicheng,For contributions to visual content understanding techniques and applications
207,0.6617952585220337,0.16863515973091125,0.529327392578125,1,Aluru,Srinivas,For contributions to parallel methods in computational biology and leadership in data science
208,0.6386594772338867,0.8575221300125122,0.7679630517959595,0,Gribble,Steven,"For contributions to virtualization technology across clusters, servers, and networks"
209,0.5564602017402649,0.9509062767028809,0.5417695045471191,0,Low,Steven H.,For theoretical foundations and real-world deployment of Internet congestion control and smart grid optimization
210,0.5998150110244751,0.051809996366500854,0.4023233652114868,1,Salzberg,Steven,"For contributions to computational biology, including software for DNA sequence analysis, alignment, and genome assembly"
211,0.6835851669311523,0.43016767501831055,0.38243064284324646,1,Hambrusch,Susanne E,For research and leadership contributions to computer science education
212,0.2920035123825073,0.6240492463111877,0.03916338086128235,8,Koenig,Sven,"For contributions to artificial intelligence, including heuristic search and multi-agent coordination"
213,0.3264608085155487,0.08419686555862427,0.45889320969581604,9,Eiter,Thomas,"For contributions to knowledge representation and reasoning, logic programming, and declarative problem solving"
214,0.45903319120407104,0.6509777903556824,0.07268619537353516,8,Walsh,Toby,For contributions to artificial intelligence
215,0.4954823851585388,0.24893584847450256,0.6027275323867798,7,Markl,Volker,"For contributions to query optimization, scalable data processing, and data programmability"
216,0.8080187439918518,0.6631689071655273,0.5908954739570618,3,Yi,Wang,For contributions to the automated analysis and verification of real-time systems
217,0.4896186888217926,0.27561548352241516,0.5234796404838562,9,Wang,Wei,For contributions to the foundation and practice of data mining
218,0.46805936098098755,0.87403804063797,0.2839243412017822,0,Diffie,Whitfield,For the invention of asymmetric public-key cryptography and the promulgation of a practical cryptographic key-exchange method
219,0.083375483751297,0.4986402690410614,0.40383946895599365,2,LI,Xuelong,For contributions to computing on and learning from higher-order data
220,0.6218603849411011,0.42294779419898987,1.0,6,Chen,Yiran,For contributions to nonvolatile memory technologies
221,0.5631206035614014,0.529656171798706,0.19819021224975586,5,Tao,Yufei,For contributions to algorithms for large scale data processing
222,0.5434568524360657,0.029822707176208496,0.6578456163406372,7,Van Der Aalst,Wil,"For contributions to process mining, process management, and data science"
223,0.6646186709403992,0.4317854344844818,0.5939285159111023,6,Calder,Bradley G,"For contributions to cloud storage; processor simulation, replay, and feedback-directed optimization of systems and applications"
224,0.4811052978038788,0.05797186493873596,0.7408286333084106,7,Zaniolo,Carlo A,For contributions to the theory and practice of data and knowledge-base systems
225,0.5024047493934631,0.8033078908920288,0.4003322124481201,0,Cachin,Christian,For contributions to secure distributed computing and cryptographic protocols
226,0.3732738792896271,0.30654415488243103,0.7450486421585083,7,Cardie,Claire,"For contributions to natural language processing, including coreference resolution,  information and opinion extraction"
227,0.4693310558795929,0.3742549419403076,0.4108228385448456,9,Whitley,Darrell,For technical and professional leadership in the field of genetic and evolutionary computation
228,0.42872750759124756,0.6629396080970764,0.5150011777877808,0,Song,Dawn,For contributions to security and privacy
229,0.31764480471611023,0.0,0.481065034866333,9,Calvanese,Diego,For contributions to description logics and their applications in data management and software engineering
230,0.43879976868629456,0.3249940872192383,0.2642080783843994,9,Stolfo,Salvatore J,For contributions to machine-learning-based cybersecurity and parallel hardware for database inference systems
231,0.5108325481414795,0.6941890120506287,0.6006861329078674,0,Frincke,Deborah,"For contributions in education, the practice of research, and the leadership of cybersecurity"
232,0.5196207165718079,0.1666138768196106,0.6072712540626526,7,Balazinska,Magdalena,For contributions to scalable distributed data systems
233,0.7685375213623047,0.5013396739959717,0.23333168029785156,5,Boisvert,Ronald F,For contributions to mathematical software and service to the profession
234,0.7793283462524414,0.5569218397140503,0.07851314544677734,5,Aaronson,Scott J,For contributions to quantum computing and computational complexity
235,0.48205745220184326,0.6420486569404602,0.627063512802124,0,Ferrari,Elena,For contributions to security and privacy of data and social network systems
236,0.1807309091091156,0.6609264016151428,0.7795590162277222,4,Churchill,Elizabeth Frances,For contributions to human-computer interaction and service to the ACM.
237,0.9056215286254883,0.4497125744819641,0.6810543537139893,3,Berger,Emery David,For contributions in memory management and programming language implementation 
238,0.506708025932312,0.7575201988220215,0.5595402121543884,0,Vigna,Giovanni,For contributions to improving the security of the Internet and combating cybercrime
239,0.03361806273460388,0.5746790170669556,0.39999696612358093,2,Pfister,Hanspeter,"For contributions to volume rendering, visualization, computer graphics, and computer vision applications"
240,0.38833755254745483,0.7114034295082092,0.7317044734954834,4,Nieh,Jason,"For contributions to operating systems, virtualization, and computer science education"
241,0.35398662090301514,0.6149280071258545,0.03151687979698181,8,Rosenschein,Jeffrey S,"For contributions to multi-agent systems, in particular, the use of game theory in multi-agent systems"
242,0.6567248106002808,0.9850645065307617,0.5314600467681885,0,Chandy,Kanianthra Mani,"For contributions to queuing networks, performance analysis, distributed and parallel programming, and distributed simulation"
243,0.05624851584434509,0.5623999238014221,0.3974573612213135,2,Bala,Kavita,For contributions to rendering and scene understanding
244,0.6793320178985596,0.8563905954360962,0.6108866333961487,0,Zhou,Lidong,For contributions to trustworthy distributed computing and to systems research and education in China
245,0.3727308511734009,0.12898951768875122,0.48198968172073364,9,Getoor,Lise,"For contributions to machine learning, reasoning under uncertainty, and responsible data science"
246,0.3653692305088043,0.509554386138916,0.42306625843048096,9,Najork,Marc,For contributions to web search and web science
247,0.23543816804885864,0.7470442056655884,0.09855383634567261,8,Gini,Maria L,For contributions to robotics and multi-agent systems and a lifelong commitment to diversity in computing
248,0.8544751405715942,0.3138200640678406,0.5431873798370361,3,Dwyer,Matthew B,For contributions to the specification and analysis of software
249,0.6485815048217773,0.8570282459259033,0.589347779750824,0,Freedman,Michael J.,For contributions to robust distributed systems for the modern cloud
250,0.59703129529953,0.053738296031951904,0.3968644142150879,1,Pop,Mihai,"For contributions to computational biology, algorithms, and software for DNA sequence analysis and sequence assembly"
251,0.1703205704689026,0.3600916266441345,0.26633918285369873,2,Singh,Mona,"For contributions to computational biology, spearheading algorithmic and machine learning approaches for characterizing proteins and their interactions"
252,0.48759233951568604,0.6587317585945129,0.150963693857193,5,Tennenholtz,Moshe,For contributions to AI and algorithmic game theory
253,0.315451979637146,0.30126750469207764,0.6466420888900757,9,Contractor,Noshir,"For contributions to advances in computational social science, network science and web science"
254,0.6407332420349121,0.6493918895721436,0.22145414352416992,5,Beame,Paul,"For contributions in computational and proof complexity and their applications, and for outstanding service"
255,0.7727437019348145,0.5387348532676697,0.0897778868675232,5,Shor,Peter W,"For contributions to quantum computing, information theory, and randomized algorithms"
256,0.19523057341575623,0.41807669401168823,0.8620700836181641,4,Cohen,Philip R,"For contributions to the theory and practice of multi-agent systems, human-computer dialogue, and multimodal interaction"
257,0.6302011013031006,0.9073354601860046,0.5583423972129822,0,Shenoy,Prashant J,For contributions to the modeling and design of distributed systems
258,0.7171235680580139,0.5002261400222778,0.9634876251220703,6,Marculescu,Diana,For contributions to the design and optimization of energy-aware computing systems
259,0.5276919603347778,0.008588612079620361,0.7089452743530273,7,Reuter,Andreas,For contributions to database concurrency control and for service to the community
260,0.08029741048812866,0.6330339312553406,0.38907119631767273,2,Youssef,Moustafa A,For contributions to location tracking algorithms
261,0.7043309807777405,0.5462180376052856,0.27597135305404663,5,Vishnoi,Nisheeth,"For contributions to theoretical computer science and its connections with mathematics, sciences, and social sciences"
262,0.1783612072467804,0.510513961315155,0.5346269607543945,2,Tao,Dacheng,For contributions to representation learning and its applications
263,0.7365899085998535,0.41508686542510986,0.7860671281814575,6,Xie,Yuan,For contributions to the design techniques and tools for the implementation and evaluation of computer architectures
264,0.2931045889854431,0.3085193634033203,0.7192367315292358,9,Mihalcea,Rada,"For contributions to natural language processing, with innovations in data-driven and graph-based language processing"
265,0.6902506351470947,0.8098142147064209,0.4358629286289215,0,Sitaraman,Ramesh Kumar,"For contributions to content delivery networks, distributed systems, and scalable Internet services"
266,0.25188732147216797,0.7137298583984375,0.06707417964935303,8,Murphy,Robin R,For contributions in founding and advancing the field of computing for disasters and robotics
267,0.698689877986908,0.34285324811935425,0.6956167817115784,6,Amarasinghe,Saman,"For contributions to high performance computing on modern hardware platforms, domain-specific languages, and compilation techniques
"
268,0.32422709465026855,0.04355013370513916,0.48746269941329956,9,McIlraith,Sheila,For contributions to knowledge representation and its applications to automated planning and semantic web services
269,0.43022632598876953,0.7069100141525269,0.7462067008018494,4,Lu,Songwu,For helping create a more resilient and performant cellular network
270,0.4697903096675873,0.6853513121604919,0.6382737755775452,0,Capkun,Srdjan,For contributions to systems and wireless network security
271,0.37594372034072876,0.5917264819145203,0.7238155603408813,4,Seshan,Srinivasan,"For contributions to computer networking, mobile computing and wireless communications"
272,0.28197240829467773,0.6408893465995789,0.009508013725280762,8,Kambhampati,Subbarao,For contributions to automated planning and human-aware AI systems and leadership within the field
273,0.5330892205238342,0.33766013383865356,0.19328579306602478,1,Kolda,Tamara G,"For innovations in algorithms for tensor decompositions, contributions to data science, and community leadership"
274,0.5305302143096924,0.6312923431396484,0.796790599822998,6,Abdelzaher,Tarek,"For interdisciplinary contributions that bridge cyber-physical systems, social sensing, real-time computing, and control"
275,0.009539157152175903,0.49309393763542175,0.09181702136993408,2,Chan,Timothy,"For contributions to computational geometry, algorithms, and data structures"
276,0.6103519797325134,0.9305511713027954,0.7055907845497131,0,Pinkston,Timothy,"For contributions to interconnection network routing algorithms and architectures, and leadership in expanding computing research"
277,0.43613409996032715,0.6330419778823853,0.08444249629974365,8,Conitzer,Vincent,"For contributions to game theory, social choice theory, and mechanism design"
278,0.1214655339717865,0.61358243227005,0.801193356513977,4,Mackay,Wendy Elizabeth,"For contributions to human-computer interaction, mixed reality and participatory design, and leadership in ACM SIGCHI"
279,0.6330357789993286,0.002534031867980957,0.42760151624679565,1,Li,Xiangyang,"For contributions to the design, analysis and optimization of IoT and mobile systems
"
280,0.1376413106918335,0.5347750782966614,0.5579708218574524,2,Chen,Xilin,For contributions to face and sign language recognition and multimedia systems
281,0.3839179575443268,0.6937286257743835,0.712807834148407,4,Wolman,Alec,For contributions to trusted mobile systems and services
282,0.5852258801460266,0.8326843976974487,0.5872039198875427,0,Snoeren,Alex C.,"For innovative approaches to measuring, managing and directing network traffic"
283,0.45765647292137146,0.8525604009628296,0.6416728496551514,0,Bruckman,Amy S,For contributions to collaborative computing and foundational work in Internet research ethics.
284,0.7971736788749695,0.4191991686820984,0.7244755625724792,6,Dehon,Andre M,"For contributions to architecture exploration and design automation of spatially programmable computing fabrics, especially FPGAs"
285,0.7045011520385742,0.547349750995636,0.27474918961524963,5,Wigderson,Avi,For contributions to theoretical computer science and mathematics
286,0.22779932618141174,0.40909188985824585,0.47170692682266235,2,Manjunath,Bangalore S,"For contributions to image search and retrieval with applications in digital libraries, marine sciences, and biology"
287,0.6819985508918762,0.7928311824798584,0.42329907417297363,0,Maggs,Bruce M,For contributions to the development of content distribution networks and the theory of computer networks
288,0.21010950207710266,0.6065109968185425,0.10777643322944641,8,Halperin,Dan,For contributions to robust geometric computing and applications to robotics and automation
289,0.4084339737892151,0.6508873701095581,0.05581247806549072,8,Parkes,David,"For contributions to computational markets, including novel mechanism design and incentive engineering methods"
290,0.7292161583900452,0.855548620223999,0.6511449813842773,0,Keeton,Kimberly,"For contributions improving the dependability, manageability, and usability of storage and novel memory systems"
291,0.46399325132369995,0.5668681859970093,0.7534140348434448,4,Gerla,Mario,For contributions to design and analysis of mobile wireless protocols for vehicular safety and traffic applications
292,0.5077581405639648,0.8997000455856323,0.5796422958374023,0,Roughan,Matthew,"For contributions to Internet measurement and analysis, with applications to network engineering"
293,0.12309965491294861,0.5783818960189819,0.498412162065506,2,Hertzmann,Aaron,"For contributions to computer graphics, non-photorealistic rendering, computer animation, and machine learning"
294,0.4658627510070801,0.6303768754005432,0.5371183156967163,0,Thuraisingham,Bhavani,"For contributions to methods, tools, and systems for security and privacy of data and applications"
295,0.36696717143058777,0.5221354961395264,0.14037355780601501,8,Tesauro,Gerald,"For contributions to reinforcement learning, neural networks, and intelligent autonomous agents"
296,0.6906086206436157,0.7344852089881897,0.3720592260360718,5,Leighton,Tom,"For his leadership in the establishment of content delivery networks, and his contributions to algorithm design"
297,0.36484968662261963,0.5617767572402954,0.6988300085067749,4,Belding,Elizabeth,For contributions to communication in mobile networks and their deployment in developing regions
298,0.35835975408554077,0.49507275223731995,0.3770354688167572,9,Voorhees,Ellen M,"For contributions in evaluation of information retrieval, question answering, and other language technologies"
299,0.20203498005867004,0.44010481238365173,0.48657044768333435,2,Li,Fei-Fei,For contributions in building large knowledge bases for machine learning and visual understanding
300,0.6374915838241577,0.282832533121109,0.5722723007202148,1,Mueller,Frank,"For contributions to the predictability of real-time systems, resilience in high-performance computing, and multi-threading techniques"
301,0.7551155090332031,0.2035297155380249,0.29472702741622925,1,Agha,Gul,"For research in concurrent programming and formal methods, specifically the Actor Model"
302,0.712497353553772,0.8227424621582031,0.4368581771850586,0,Parulkar,Gurudatta,For contributions to improving the Internet architecture and open source software
303,0.4147511124610901,0.2778158187866211,0.5604546070098877,9,Liu,Huan,For contributions in feature selection for data mining and knowledge discovery and in social computing
304,0.5302594304084778,0.7574313282966614,0.2985982298851013,5,Camenisch,Jan,For contributions to privacy-enhancing cryptographic protocols and leadership in their practical realization
305,0.09826213121414185,0.5392398834228516,0.6439869999885559,2,Hodgins,Jessica K,"For contributions to character animation, human simulation, and humanoid robotics."
306,0.21900954842567444,0.588649570941925,0.5493941903114319,2,Luo,Jiebo,For contributions to multimedia content analysis and social multimedia informatics
307,0.5808156728744507,0.7328864336013794,0.175958514213562,5,H stad,Johan,"For contributions in circuit complexity, approximability and inapproximability, and foundations of pseudorandomness"
