,x,y,z,cluster,last name,given name,citation
0,0.990442156791687,0.3075840473175049,0.5499808192253113,3,Hassan,Ahmed E.,For contributions to the quality assurance of large scale software systems
1,0.6563668251037598,0.16714856028556824,0.5248043537139893,1,Pothen,Alex,"For contributions to and leadership in combinatorial scientific computing
"
2,0.516647219657898,0.0375121533870697,0.688156008720398,7,Kemper,Alfons,"For contributions to database management system technology
"
3,0.5234633684158325,0.31619903445243835,0.20891854166984558,1,Anandkumar,Anima,For contributions to tensor methods for probabilistic models and neural operators
4,0.411665141582489,0.6053488850593567,0.8512691259384155,4,Sabharwal,Ashutosh,For the invention of full-duplex wireless and open-source wireless research platforms
5,0.9520398378372192,0.3337481617927551,0.4631386995315552,3,Curtis,Bill,"For contributions to software process,  software measurement, and human factors in software engineering"
6,0.5829850435256958,0.776572585105896,0.19561871886253357,5,Barak,Boaz,"For contributions to theoretical computer science, in particular cryptography and computational complexity, and service to the theory community"
7,0.685461699962616,0.694868266582489,0.32702022790908813,5,de Supinski,Bronis R.,For contributions to the design of large-scale systems and their programming systems and software
8,0.04004010558128357,0.6077938079833984,0.30585676431655884,2,Kuo,Chung C,"For contributions to technologies, applications, and mentorship in visual computing"
9,0.4204871952533722,0.6060441732406616,0.1039070188999176,8,Daskalakis,Constantinos,"For fundamental contributions to algorithmic game theory, mechanism design, sublinear algorithms and theoretical machine learning"
10,0.4858643412590027,0.2748029828071594,0.3007548451423645,1,Cortes,Corinna,"For theoretical and practical contributions to machine learning, industrial leadership, and service to the field"
11,0.04036599397659302,0.5828198194503784,0.2704407572746277,2,Gotsman,Craig,"For contributions to computer graphics, geometry processing, and visual computing
"
12,0.009819000959396362,0.4950064718723297,0.07387283444404602,2,Mount,David M,For contributions to algorithms and data structures for geometric data analysis and retrieval
13,0.015523403882980347,0.5690264701843262,0.2520511746406555,2,Zorin,Denis,"For contributions to computer graphics, geometry processing, and scientific 
computing"
14,0.36625468730926514,0.37528640031814575,0.7633059024810791,4,Yu,Dong,"For contributions in speech processing and deep learning applications
"
15,0.38879263401031494,0.30377793312072754,0.5673844814300537,9,Chi,Ed H.,"For contributions to machine learning and data mining techniques for social computing and recommender systems
"
16,0.994171142578125,0.44537898898124695,0.5364088416099548,3,Koushanfar,Farinaz,"For contributions to secure computing and privacy-preserving machine learning
"
17,0.33452922105789185,0.30156606435775757,0.39744699001312256,9,Li,Hang,For contributions to machine learning for search and dialogue
18,0.9188623428344727,0.41346102952957153,0.5461095571517944,3,Hicks,Michael W,"For contributions to programming language design and implementation, program analysis, and software security."
19,0.4616512954235077,0.32796353101730347,0.24206677079200745,9,Xing,Eric,"For contributions to algorithms, architectures, and applications in machine learning
"
20,0.2210286557674408,0.7015780210494995,0.5109068751335144,2,Sullivan,Gary J.,For contributions to video and image compression and leadership in its standardization
21,0.37471285462379456,0.5020744204521179,0.3415129780769348,9,Navarro,Gonzalo,For theoretical and practical contributions to the fields of text searching and compact data structures
22,0.43602484464645386,0.6574458479881287,0.7090778946876526,4,Zheng,Haitao,For contributions to wireless networking and mobile computing
23,0.21205070614814758,0.7450805902481079,0.8431705236434937,4,Ishii,Hiroshi,For contributions to tangible user interfaces and to human-computer interaction
24,0.8585687875747681,0.25722232460975647,0.5503661632537842,3,Mei,Hong,"For contributions to software engineering research and translation, and establishing  research standards in China"
25,0.32882678508758545,0.3572089672088623,0.4287131428718567,9,Teevan,Jaime,"For contributions to human-computer interaction, information retrieval, and productivity"
26,0.2726782262325287,0.6463508605957031,0.8588669300079346,4,Hong,Jason,For contributions to ubiquitous computing and to usable privacy and security
27,0.4196997582912445,0.9981876611709595,0.5367717146873474,0,Stasko,John,"For contributions to the design, analysis, usage, and evaluation of software and information visualization"
28,0.46563565731048584,0.36228078603744507,0.4151575267314911,9,Deb,Kalyanmoy,"For technical contributions in evolutionary  multi-objective optimization algorithms and multi-criterion decision support
"
29,0.1888541579246521,0.626911997795105,0.9017661809921265,4,Toyama,Kentaro,For contributions to the innovation and critique of digital technology for socio-economic development and social justice
30,0.38194000720977783,0.7257933616638184,0.638502836227417,4,Fu,Kevin,"""For contributions to computer security, and especially to the secure engineering of medical devices.""
"
31,0.815555989742279,0.41573652625083923,0.6961187124252319,3,Ceze,Luis H,For contributions to developing new architectures and programming systems for emerging applications and computing technologies
32,0.4181133508682251,1.0,0.536226749420166,0,Agrawala,Maneesh,"For contributions to visual communication through computer graphics, human-computer interaction, and information visualization"
33,0.8299826383590698,0.413876473903656,0.6731565594673157,3,Hermenegildo,Manuel V,"For contributions to program analysis, verification, parallelism, logic programming, and the IMDEA Software Institute"
34,0.14101451635360718,0.3868906497955322,0.25599998235702515,2,Pollefeys,Marc,"For contributions to geometric computer vision and applications to AR/VR/MR, robotics, and autonomous vehicles"
35,0.23664136230945587,0.6380550861358643,0.7905721664428711,4,Beaudouin-Lafon,Michel,"For contributions to human-computer interaction, instrumental interaction and generative theory, and community leadership"
36,0.45656925439834595,0.1545826494693756,0.43398478627204895,9,Chawla,Nitesh,"For contributions to machine learning research for imbalanced data, graphs, and interdisciplinary innovations"
37,0.5350231528282166,0.1268296241760254,0.729742705821991,7,Boncz,Peter,"For contributions to the design of columnar, main-memory, and vectorized database systems"
38,0.801458477973938,0.5832824110984802,0.07939141988754272,5,Qureshi,Moinuddin,For contributions to memory hierarchy design
39,0.7584503889083862,0.4359755516052246,0.8349217176437378,6,Atienza Alonso,David,For contributions to the design of high-performance integrated systems and ultra-low power edge circuits and architectures
40,0.6526042819023132,0.5544309020042419,0.831439733505249,6,Henkel,Joerg,For contributions to hardware/software co-design of power and thermal efficient embedded computing
41,0.5493797063827515,0.604296088218689,0.17669841647148132,5,Khuller,Samir,For contributions to algorithm design with real-world implications and for mentoring and community-building
42,0.1425943672657013,0.38066571950912476,0.25898900628089905,2,Soatto,Stefano,For contributions to the foundations and applications of visual geometry and visual representations learning
43,0.5574966669082642,0.6113350987434387,0.8080735206604004,6,Marculescu,Radu,"For contributions to low-power and communication-based design of embedded systems
"
44,0.5402781367301941,0.7578704953193665,0.23312363028526306,5,Pass,Rafael,"For contributions to the foundations of cryptography
"
45,0.42083048820495605,0.5331546068191528,0.7685237526893616,4,Chandra,Ranveer,"For contributions to software-defined wireless networking and applications to agriculture and rural broadband
"
46,0.15064576268196106,0.5278251767158508,0.37184402346611023,2,Vidal,Rene,For contributions to subspace clustering and motion segmentation in computer vision
47,0.7697228193283081,0.5528524518013,0.07105275988578796,5,Irani,Sandy,For contributions to the theory of online algorithms and quantum complexity theory
48,0.24653859436511993,0.7716957330703735,0.08430519700050354,8,Elbaum,Sebastian,"For contributions to the analysis and testing of evolving systems and robotic systems
"
49,0.38497892022132874,0.6400066614151001,0.9003821015357971,4,Helal,Sumi,"For contributions to mobile and pervasive computing, and their applications in graceful aging and accessibility"
50,0.6489419341087341,0.4196818470954895,0.7905408143997192,6,Sherwood,Tim,For contributions to computer system security and performance analysis
51,0.61224764585495,0.7516706585884094,0.578071117401123,0,Hoefler,Torsten,"For foundational contributions to High Performance Computing and the application of HPC techniques to machine learning
"
52,0.2368900626897812,0.7413883209228516,0.5138877034187317,2,Zhu,Wenwu,"For contributions to multimedia networking and network representation
"
53,0.7298285961151123,0.4157416820526123,0.40233343839645386,1,Lin,Jimmy,"For contributions to question answering, information retrieval, and natural language processing
"
54,0.12285232543945312,0.5772982835769653,0.36500823497772217,2,Yu,Yizhou,For contributions to computer graphics and computer vision
55,0.4833733141422272,0.6283270716667175,0.7640637755393982,4,Fang,Yuguang,For contributions to wireless networks and mobile computing
56,0.9407273530960083,0.37764570116996765,0.5099399089813232,3,Su,Zhendong,For contributions to software testing and analysis
57,0.28715768456459045,0.6866574883460999,0.8691076040267944,4,Dey,Anind,For contributions to ubiquitous computing and large-scale behavioral studies
58,0.5570336580276489,0.4459894895553589,0.16607952117919922,5,Gupta,Anupam,"For contributions to approximation algorithms, online algorithms, stochastic algorithms and metric embeddings"
59,0.7329325675964355,0.1871841847896576,0.2897642254829407,1,Sistla,Aravinda P,"For contributions to verifying concurrent programs, probabilistic systems, security and database systems"
60,0.1738174557685852,0.7355770468711853,0.8909181952476501,4,Friedman,Batya,For contributions to human values in the technical design process
61,0.2767013907432556,0.5889239311218262,0.07707244157791138,8,Nebel,Bernhard,"For contributions to knowledge representation and reasoning, automatic planning, and their applications in robotics
"
62,0.1537925899028778,0.5137428641319275,0.4886970818042755,2,Schiele,Bernt,"For contributions to large-scale object recognition, human detection, and pose estimation"
63,0.8397185802459717,0.3995775878429413,0.41529959440231323,3,Nikolaj,Bjorner,For contributions to SMT solvers and network verification
64,0.42972007393836975,0.6721639633178711,0.9505003094673157,4,Ganesan,Deepak,"For contributions to ultra-low power wireless sensing systems
"
65,0.20739850401878357,0.43342024087905884,0.4834625720977783,2,Li,Feifei,For contributions to query processing and optimization and to cloud database systems
66,0.32526278495788574,0.3443145155906677,0.42948439717292786,9,White,Ryen W,"For contributions to information retrieval, human-computer interaction, and computational health"
67,0.6081099510192871,0.42856311798095703,0.7713771462440491,6,Tehranipoor,Mark,For contributions to microelectronics security and trust
68,0.060621172189712524,0.4872824251651764,0.1566113531589508,2,Sheffer,Alla,"For contributions to geometry processing, mesh parameterization, and perception-driven shape analysis and modeling"
69,0.4820898473262787,0.7620362639427185,0.38808491826057434,0,Waters,Brent,For contributions to cryptography
70,0.6627074480056763,0.6575304865837097,0.260078102350235,5,Miller,Dale A,For contributions to proof theory and computational logic
71,0.3883915841579437,0.6377959251403809,0.9004876613616943,4,Choudhury,Tanzeem,For contributions to mobile systems for behavioral sensing and health interventions
72,0.4787912666797638,0.2884617745876312,0.2437795102596283,1,Liu,Tie-Yan,"For contributions to machine learning algorithms and their applications
"
73,0.4405314326286316,0.22019556164741516,0.2513803541660309,9,Chang,Edward Y,For contributions to scalable machine learning and healthcare
74,0.45579811930656433,0.32023197412490845,0.19328391551971436,9,Hazan,Elad,For contributions to efficient algorithms for convex and nonconvex optimization
75,0.6447017788887024,0.5717463493347168,0.13099676370620728,5,Mossel,Elchanan,For contributions to theoretical computer science and inference
76,0.36020421981811523,0.29790499806404114,0.4265998899936676,9,Gabrilovich,Evgeniy,"For contributions to the acquisition, representation, and dissemination of web-knowledge with applications to the medical domain"
77,0.45410171151161194,0.2264116108417511,0.45772767066955566,9,Das,Gautam,For contributions to database search and graph algorithms
78,0.6110124588012695,0.929391086101532,0.7073631882667542,0,Ricart,Glenn,"For leadership in creating advanced research infrastructure including the first Internet interconnection point
"
79,0.6221306920051575,0.42320361733436584,0.9996074438095093,6,Li,Hai,For contributions to neuromorphic computing and deep-learning acceleration
80,0.7004193067550659,0.3117964267730713,0.6928779482841492,6,Franke,Hubertus,"For contributions to the communication, concurrency and resource control in parallel systems"
81,0.18034082651138306,0.6774802803993225,0.7916210889816284,4,Wobbrock,Jacob Otto,"For contributions to human-computer interaction and accessible computing
"
82,0.8345028162002563,0.6036504507064819,0.5162643790245056,3,Ouaknine,Joel,For contributions to algorithmic analysis of dynamical systems
83,0.5207321047782898,0.7429065704345703,0.3517778813838959,0,Katz,Jonathan,For contributions to cryptographic protocol design and cryptography education
84,0.6952148079872131,0.43755024671554565,0.3774935305118561,1,Gal-Ezer,Judith,For contributions to research and implementation in computer science education
85,0.4664458632469177,0.7927709817886353,0.3502386212348938,0,Adleman,Leonard M.,"For contributions to making public-key cryptography useful in practice
"
86,0.6622358560562134,0.43132027983665466,0.8167197108268738,6,Eeckhout,Lieven,For contributions in computer architecture performance analysis and modeling
87,0.5023868680000305,0.6044360399246216,0.8295044302940369,6,Zhong,Lin,For contributions to mobile and network systems
88,0.4227241277694702,0.7205491662025452,0.5120729804039001,0,Camp,Linda Jean,For contributions to computer security and e-crime measures
89,0.6296969056129456,0.5390633344650269,0.14128011465072632,5,Trevisan,Luca,For contributions to complexity theory and combinatorial optimization
90,0.5879379510879517,0.578784704208374,0.18228861689567566,5,Braverman,Mark,"For contributions to computational complexity, information theory, and algorithmic mechanism design"
91,0.5613951683044434,0.0911916196346283,0.7477223873138428,7,Farach-Colton,Martin,For contributions to data structures for biocomputing and big data
92,0.23574119806289673,0.5590359568595886,0.12856388092041016,8,Mason,Matthew T,For contributions to robotic manipulation and manipulation path planning
93,0.3579486608505249,0.7433266043663025,0.6272218227386475,4,Balakrishnan,Meenakshi,"For contributions to system-level design, embedded systems and assistive technologies for the visually impaired"
94,0.15225961804389954,0.5352594256401062,0.520736813545227,2,Yang,Ming-Hsuan,"For contributions to visual tracking, face processing, and low-level vision"
95,0.4756673276424408,0.17709991335868835,0.42828673124313354,9,Zaki,Mohammed,For contributions to data mining algorithms and foundations
96,0.17445135116577148,0.6408812999725342,0.7325271368026733,4,Shah,Mubarak Ali,For contributions to human action recognition in video and leadership for undergraduate research experience
97,0.35506778955459595,0.60295569896698,0.0,8,Singh,Munindar P.,For contributions to artificial intelligence and multiagent systems and their applications in service-oriented computing and sociotechnical systems
98,0.41906610131263733,0.6440309286117554,0.5150134563446045,0,Li,Ninghui,"For contributions to data privacy, access control, and trust management"
99,0.8754177093505859,0.34433650970458984,0.5078235268592834,3,Inverardi,Paola,For contributions to software architecture
100,0.391084760427475,0.3437539339065552,0.5876550078392029,9,Zhao,Ben Y.,"For contributions to peer-to-peer systems and online social networks
"
101,0.03749459981918335,0.4796038568019867,0.1717815101146698,2,Cohen-Or,Daniel,"For contributions to computer graphics, geometry processing and visual computing"
102,0.6352677345275879,0.1727427840232849,0.5157204866409302,1,Bader,David A,"For contributions to high-performance computing systems, graph analytics, and technical leadership in parallel computing"
103,0.8168197870254517,0.5706663727760315,0.870378851890564,6,Pan,David Z.,"For contributions to electronic design automation, including design for manufacturing and physical design"
104,0.39376458525657654,0.26969560980796814,0.5365804433822632,9,Tang,Jie,For contributions to information and social network mining
105,0.40475547313690186,0.6331592798233032,0.47245562076568604,0,Samarati,Pierangela,For contributions to data security and privacy
106,0.5682070851325989,0.7646175622940063,0.2085786759853363,5,Ostrovsky,Rafail,For contributions to the foundations of cryptography
107,0.02768486738204956,0.47997066378593445,0.16304060816764832,2,Wang,Wenping,For contributions to geometric modeling and computer graphics
108,0.50938481092453,0.712544858455658,0.18783512711524963,5,Fiat,Amos,"For contributions to cryptography, online algorithms, and algorithmic game theory"
109,0.6551100015640259,0.4137003719806671,0.7701230049133301,6,Kaeli,David R,For contributions to computer architecture and compilers
110,0.8848564624786377,0.394137442111969,0.5234394073486328,3,Jhala,Ranjit,For contributions to software verification
111,0.6553714871406555,0.44219306111335754,0.6117932796478271,6,Ross,Robert B,For contributions to high-performance computing in storage and parallel I/O
112,0.4298499524593353,0.6094761490821838,0.10455146431922913,8,Kleinberg,Robert,For contributions to online learning and decision problems
113,0.4271676540374756,0.6236310005187988,0.953580379486084,4,Picard,Rosalind Wright,For contributions to physiological signal sensing for individual health and wellbeing
114,0.6890669465065002,0.14199021458625793,0.3175278902053833,1,Smolka,Scott,"For contributions in process algebra, model checking, and runtime verification"
115,0.8972010016441345,0.38283300399780273,0.5333248376846313,3,Qadeer,Shaz,"For contributions to software verification, software testing, and programming languages
"
116,0.3044446110725403,0.6197319030761719,0.038555294275283813,8,Zilberstein,Shlomo,"For contributions to automated planning, resource-bounded reasoning, and multi-agent systems"
117,0.04646691679954529,0.5139711499214172,0.3537236452102661,2,Marschner,Steve,For contributions to modeling the appearance of physical materials
118,0.4946293532848358,0.2557554841041565,0.21538853645324707,1,Sarawagi,Sunita,"For contributions to statistical machine learning for information analysis, extraction, and integration"
119,0.4438880383968353,0.6507307291030884,0.523404598236084,0,Jajodia,Sushil,"For contributions to cyber security, data protection, and privacy
"
120,0.0733959972858429,0.4163217544555664,0.21976995468139648,2,Rusinkiewicz,Szymon,"For contributions to acquisition, representation, analysis, rendering, and fabrication of 3D models"
121,0.6451911330223083,0.5426275730133057,0.8275490999221802,6,Rosing,Tajana,"For contributions to power, thermal, and reliability management"
122,0.05925333499908447,0.6135631799697876,0.24140214920043945,2,Xie,Tao,For contributions to software testing and analytics
123,0.5479510426521301,0.137216717004776,0.44644954800605774,1,Lengauer,Thomas,For contributions to bioinformatics and medical informatics
124,0.9824550151824951,0.3368684649467468,0.5514335036277771,3,Zimmermann,Thomas,For contributions to mining software repositories and defect prediction
125,0.635754406452179,0.5744891166687012,0.8572216033935547,6,Hu,Xiaobo Sharon,For contributions to the design of power-constrained and real-time embedded systems
126,0.46314966678619385,0.05939313769340515,0.6682705283164978,7,Ives,Zachary,"For contributions to data integration, sharing, and management for scientific applications"
127,0.4578871428966522,0.5670866370201111,0.7036054730415344,4,Haas,Zygmunt J.,For contributions to communication and security protocols for ad hoc and sensor networks
128,0.5281223058700562,0.6924777626991272,0.42452189326286316,0,Smith,Adam,For contributions to data privacy and cryptography
129,0.4406982958316803,0.7631169557571411,0.3813193142414093,0,Shamir,Adi,For contributions to the field of cryptography
130,0.766974925994873,0.5260291695594788,0.13092297315597534,5,Edelman,Alan,For contributions to algorithms and languages for numerical and scientific computing
131,0.7516977787017822,0.8232442736625671,0.6707872152328491,6,Arpaci-Dusseau,Andrea,For contributions to storage and computer systems
132,0.92694091796875,0.43656909465789795,0.5532394647598267,3,Gordon,Andrew D.,"For contributions to programming languages: their principles, logic, usability, and trustworthiness"
133,0.38264569640159607,0.5533123016357422,0.4530273377895355,9,Tomkins,Andrew,For contributions to the understanding of the web and web-based social networks
134,0.6205992698669434,0.021786034107208252,0.4179885983467102,1,Gonzalez,Antonio,For contributions to the design of energy-efficient and resilient computer architectures
135,0.6207910776138306,0.8681168556213379,0.5612767934799194,0,Krishnamurthy,Arvind,For contributions to networks and distributed computer systems
136,0.3256129324436188,0.3392077684402466,0.7360752820968628,4,Dorr,Bonnie J,For human-centered and linguistically inspired approaches to natural language processing
137,0.4198852777481079,0.7466822862625122,0.5174534916877747,0,Levine,Brian,"For contributions to network forensics, security, and privacy, and for thwarting crimes against children
"
138,0.8722366094589233,0.4195123016834259,0.493832528591156,3,Hoare,C. Antony R.,"For contributions to the theory of programming, and its application to the practice of engineering of software
"
139,0.4263158440589905,0.7067316770553589,0.9544275999069214,4,Narayanaswami,Chandra,"For design and development of the Linux Watch and SoulPad, which influenced wearable and mobile systems"
140,0.8522359728813171,0.4093225598335266,0.6351809501647949,3,Flanagan,Cormac,For contributions to static and dynamic program debugging and verification methods
141,0.6630657911300659,0.4599051773548126,0.8757673501968384,6,Brooks,David,For contributions to software and hardware design for power-efficient computer architectures
142,0.5683808922767639,0.5083760619163513,0.6167990565299988,6,Maltz,David,"For contributions to networking infrastructure, including data center networking, network operating systems, and cloud networking"
143,0.530829668045044,0.6634957790374756,0.786709189414978,6,Lu,Chenyang,"For contributions to adaptive real-time systems, real-time virtualization, and wireless cyber-physical systems"
144,0.45120543241500854,0.31700122356414795,0.43287578225135803,9,Hoos,Holger H.,For contributions to automated algorithm selection and configuration for optimization and machine learning
145,0.5433860421180725,0.10383987426757812,0.4418852627277374,1,Wu,Cathy H,"For contributions to bioinformatics, computational biology, knowledge mining and semantic data integration"
146,0.11390474438667297,0.3656127154827118,0.2676301598548889,2,Fox,Dieter,"For contributions to probabilistic state estimation, RGB-D perception, and learning for robotics and computer vision
"
147,0.6713078618049622,0.465995192527771,0.918163537979126,6,Parhi,Keshab K.,For contributions to architectures and design tools for signal processing and networking accelerators
148,0.9775255918502808,0.2763811945915222,0.491499662399292,3,Williams,Laurie Ann,"For contributions to empirical research on agile software development, software security, and software engineering education"
149,0.7364557981491089,0.5188470482826233,0.8581398725509644,6,John,Lizy Kurian,"For contributions to the design, modeling and benchmarking of computer architectures"
150,0.24823175370693207,0.5980165004730225,0.8418668508529663,4,Morris,Meredith Ringel,"For contributions to human-computer interaction, information retrieval, computer-supported cooperative work, and accessibility
"
151,0.0983104407787323,0.5392734408378601,0.6440712213516235,2,Zyda,Michael J,"For contributions to game design, game and virtual reality networking, and body tracking"
152,0.4821808934211731,0.9328655004501343,0.5580750703811646,0,Duffield,Nicholas,For contributions to network measurement and analysis
153,0.30670422315597534,0.29415884613990784,0.6243370771408081,9,Menczer,Filippo,For research on the vulnerability of social media networks to disinformation and manipulation
154,0.8925210237503052,0.538812518119812,0.4309414029121399,3,Plotkin,Gordon,"For contributions to the science of programming languages, particularly their operational and denotational semantics"
155,0.6716052293777466,0.22764670848846436,0.5523465275764465,1,Park,Haesun,"For contributions to numerical algorithms, data analytics, and leadership in computational science and engineering"
156,0.19945794343948364,0.590359628200531,0.5318259000778198,2,Shen,Heng Tao,"For contributions to large-scale multimedia content understanding, indexing and retrieval"
